{
  "$schema": "https://json-schema.org/draft/2020-12/schema",
  "$id": "https://hpe.dev/schema/deck.schema.json",
  "title": "HPE deck manifest",
  "type": "object",
  "additionalProperties": false,
  "required": ["schemaVersion", "id", "title", "size", "theme", "slides"],
  "properties": {
    "$schema": { "type": "string", "minLength": 1 },
    "schemaVersion": { "const": 1 },
    "id": { "type": "string", "pattern": "^[a-z][a-z0-9-]*$" },
    "title": { "type": "string", "minLength": 1 },
    "size": {
      "type": "object",
      "additionalProperties": false,
      "required": ["width", "height"],
      "properties": {
        "width": { "type": "integer", "minimum": 1 },
        "height": { "type": "integer", "minimum": 1 }
      }
    },
    "theme": {
      "oneOf": [
        { "$ref": "#/$defs/safePath" },
        {
          "type": "object",
          "additionalProperties": false,
          "required": ["entry"],
          "properties": {
            "entry": { "$ref": "#/$defs/safePath" },
            "alternates": {
              "type": "array",
              "minItems": 1,
              "uniqueItems": true,
              "items": { "$ref": "#/$defs/safePath" }
            }
          }
        }
      ]
    },
    "slides": {
      "type": "array",
      "minItems": 1,
      "items": {
        "type": "object",
        "additionalProperties": false,
        "required": ["id", "file"],
        "properties": {
          "id": { "type": "string", "pattern": "^[a-z][a-z0-9-]*$" },
          "file": { "$ref": "#/$defs/safePath" },
          "title": { "type": "string", "minLength": 1 },
          "maxStep": { "type": "integer", "minimum": 0 },
          "durationMs": { "type": "integer", "minimum": 0 }
        }
      }
    }
  },
  "$defs": {
    "safePath": {
      "type": "string",
      "minLength": 1,
      "pattern": "^(?!/)(?!.*\\\\)(?!.*(?:^|/)\\.\\.(?:/|$)).+$"
    }
  }
}
