{
  "$schema": "../../packages/schema/src/deck.schema.json",
  "schemaVersion": 1,
  "id": "database-design-for-product",
  "title": "产品经理的数据库设计",
  "size": {
    "width": 1600,
    "height": 900
  },
  "theme": {
    "entry": "themes/database-practical/theme.ts"
  },
  "slides": [
    {
      "id": "db-00",
      "file": "slides/db-00.slide.vue",
      "title": "产品经理的数据库设计"
    },
    {
      "id": "db-01",
      "file": "slides/db-01.slide.vue",
      "title": "从类型全景到业务建模的学习路径"
    },
    {
      "id": "db-02",
      "file": "slides/db-02.slide.vue",
      "title": "MySQL 常用字段类型全景"
    },
    {
      "id": "db-03",
      "file": "slides/db-03.slide.vue",
      "title": "INT 与 BIGINT 的范围、空间和增长"
    },
    {
      "id": "db-04",
      "file": "slides/db-04.slide.vue",
      "title": "VARCHAR、TEXT 与字符串长度选择"
    },
    {
      "id": "db-05",
      "file": "slides/db-05.slide.vue",
      "title": "全部使用字符串会失去哪些能力"
    },
    {
      "id": "db-05a",
      "file": "slides/db-05a.slide.vue",
      "title": "数据类型选错的六类系统代价"
    },
    {
      "id": "db-06",
      "file": "slides/db-06.slide.vue",
      "title": "小数、日期、真假和文件类型"
    },
    {
      "id": "db-07",
      "file": "slides/db-07.slide.vue",
      "title": "NULL、空字符串、0 与 false 的业务含义"
    },
    {
      "id": "db-08",
      "file": "slides/db-08.slide.vue",
      "title": "状态字段的代码、变化与历史"
    },
    {
      "id": "db-09",
      "file": "slides/db-09.slide.vue",
      "title": "ID 的五种角色：主键、外键、公开、业务与外部 ID"
    },
    {
      "id": "db-10",
      "file": "slides/db-10.slide.vue",
      "title": "普通列与 JSON 的使用边界"
    },
    {
      "id": "db-11",
      "file": "slides/db-11.slide.vue",
      "title": "常用公共字段及其职责"
    },
    {
      "id": "db-12",
      "file": "slides/db-12.slide.vue",
      "title": "简化用户故事：模板、任务、输入与运行"
    },
    {
      "id": "db-13",
      "file": "slides/db-13.slide.vue",
      "title": "ER 建模：完整提取实体、动作、属性与约束"
    },
    {
      "id": "db-14",
      "file": "slides/db-14.slide.vue",
      "title": "ER 建模：四个核心实体与三个外部引用"
    },
    {
      "id": "db-15",
      "file": "slides/db-15.slide.vue",
      "title": "ER 建模：建立四张核心表"
    },
    {
      "id": "db-16",
      "file": "slides/db-16.slide.vue",
      "title": "ER 建模：填写模板与任务属性"
    },
    {
      "id": "db-17",
      "file": "slides/db-17.slide.vue",
      "title": "ER 建模：填写输入与运行属性"
    },
    {
      "id": "db-18",
      "file": "slides/db-18.slide.vue",
      "title": "ER 建模：确定三条一对多关系"
    },
    {
      "id": "db-19",
      "file": "slides/db-19.slide.vue",
      "title": "ER 建模：将规则落成约束和索引"
    },
    {
      "id": "db-19i",
      "file": "slides/db-19i.slide.vue",
      "title": "简化中台案例最终 ER 图"
    },
    {
      "id": "db-20",
      "file": "slides/db-20.slide.vue",
      "title": "数据库规范化与第一至第三范式"
    },
    {
      "id": "db-21",
      "file": "slides/db-21.slide.vue",
      "title": "第一范式（1NF）：多个值使用多行保存"
    },
    {
      "id": "db-22",
      "file": "slides/db-22.slide.vue",
      "title": "第二范式（2NF）：关系字段依赖完整关系"
    },
    {
      "id": "db-23",
      "file": "slides/db-23.slide.vue",
      "title": "第三范式（3NF）：主数据放回自己的表"
    },
    {
      "id": "db-24",
      "file": "slides/db-24.slide.vue",
      "title": "更新异常、插入异常与删除异常"
    },
    {
      "id": "db-25",
      "file": "slides/db-25.slide.vue",
      "title": "五种常用数据完整性约束"
    },
    {
      "id": "db-29",
      "file": "slides/db-29.slide.vue",
      "title": "并发控制：防止重复创建和修改覆盖"
    },
    {
      "id": "db-32",
      "file": "slides/db-32.slide.vue",
      "title": "数据完整性与业务规则的边界"
    },
    {
      "id": "db-33",
      "file": "slides/db-33.slide.vue",
      "title": "索引必须从查询条件、排序与数据分布反推"
    },
    {
      "id": "db-35",
      "file": "slides/db-35.slide.vue",
      "title": "PRD 中的字段与表关系说明模板"
    },
    {
      "id": "db-36",
      "file": "slides/db-36.slide.vue",
      "title": "14 个数据库设计评审问题"
    }
  ]
}
